{
  "schemaVersion": 2,
  "workflowVersion": "1.0.0/governance-2/schema-2",
  "projectId": "app",
  "allowedPaths": [
    "**/*"
  ],
  "deniedPaths": [
    ".git/**",
    ".env",
    ".env.*",
    "**/*.pem",
    "**/*.key"
  ],
  "commands": {
    "test": {
      "executable": "npm",
      "args": [
        "run",
        "test"
      ],
      "isolation": {
        "workingDirectory": ".",
        "image": "node@sha256:48e4b67d85f87bd551df43704e24d252f56cc5f8e9718841aace50f19948f0f9",
        "timeoutMs": 900000,
        "cpus": 2,
        "memoryMb": 2048,
        "pids": 256,
        "network": "none",
        "allowedDomains": [],
        "requiredForReview": true
      }
    },
    "lint": {
      "executable": "npm",
      "args": [
        "run",
        "lint"
      ],
      "isolation": {
        "workingDirectory": ".",
        "image": "node@sha256:48e4b67d85f87bd551df43704e24d252f56cc5f8e9718841aace50f19948f0f9",
        "timeoutMs": 900000,
        "cpus": 2,
        "memoryMb": 2048,
        "pids": 256,
        "network": "none",
        "allowedDomains": [],
        "requiredForReview": true
      }
    }
  },
  "dataClassification": "INTERNAL",
  "riskRules": [
    {
      "code": "AUTHORIZATION_CHANGE",
      "source": "affected-path",
      "profile": "HIGH_RISK",
      "pathPatterns": [
        "**/auth/**",
        "**/authorization/**",
        "**/permissions/**"
      ]
    },
    {
      "code": "CREDENTIAL_HANDLING",
      "source": "affected-path",
      "profile": "HIGH_RISK",
      "pathPatterns": [
        "**/credentials/**",
        "**/secrets/**"
      ],
      "nonDowngradable": true
    },
    {
      "code": "DATABASE_SCHEMA_CHANGE",
      "source": "affected-path",
      "profile": "HIGH_RISK",
      "pathPatterns": [
        "**/migrations/**",
        "**/schema.sql"
      ]
    },
    {
      "code": "INFRASTRUCTURE_CHANGE",
      "source": "affected-path",
      "profile": "HIGH_RISK",
      "pathPatterns": [
        "**/infra/**",
        "**/*.tf",
        "**/Dockerfile",
        "**/.github/workflows/**"
      ]
    },
    {
      "code": "PUBLIC_API_CHANGE",
      "source": "affected-path",
      "profile": "HIGH_RISK",
      "pathPatterns": [
        "**/openapi.json",
        "**/openapi.yaml",
        "**/openapi.yml",
        "**/swagger.json",
        "**/swagger.yaml",
        "**/swagger.yml",
        "**/api-contracts/**"
      ]
    },
    {
      "code": "NETWORK_REQUIREMENT",
      "source": "requested-command",
      "profile": "HIGH_RISK",
      "commandPatterns": [
        "curl*",
        "wget*",
        "Invoke-WebRequest*"
      ]
    },
    {
      "code": "GOVERNANCE_SECURITY_CHANGE",
      "source": "affected-path",
      "profile": "HIGH_RISK",
      "pathPatterns": [
        "**/.ai-delivery/**",
        "**/AGENTS.md"
      ],
      "nonDowngradable": true
    }
  ],
  "confirmations": {
    "lightweightSpecification": false,
    "lightweightPlan": false
  },
  "capabilities": {
    "allowedMcpServers": [],
    "allowedMcpOperations": [],
    "lightweightNetworkDomains": []
  },
  "validation": {
    "requiredCommands": [],
    "policyCommands": [],
    "requirePolicyValidationForHighRisk": true,
    "builtInPolicy": true
  }
}
